{
  "version": "1.0",
  "engine_used": "modelslab-qwen-tts",
  "voice_name": "approved-indian-reference-clone",
  "voice_characteristics": {
    "child_friendly": true,
    "gender": "neutral",
    "accent": "en-us",
    "pace": "120wpm-children",
    "energy": "warm"
  },
  "segments": [
    {
      "section_id": "s01-title",
      "text": "Social Studies, Class 5. Lesson 2: Earth Movement.",
      "body_text": "Social Studies, Class 5. Lesson 2: Earth Movement.",
      "spoken_heading": "",
      "heading_duration_seconds": 2.56,
      "heading_holds": [
        {
          "title": "Lesson 2: Earth Movement",
          "start_seconds": 2.56,
          "end_seconds": 4.56
        }
      ],
      "body_start_seconds": 4.56,
      "topic_end_pause_seconds": 0.0,
      "audio_path": "D:\\InkSpectrum\\OpenMontage\\projects\\class-5-social-part-0-chapter-2-earth-movement\\assets\\audio\\narration-qwen-final-v1\\s01-title.wav",
      "duration_seconds": 4.687,
      "title_card_hold_seconds": 2.0,
      "voice_used": "approved-indian-reference-clone",
      "wer": 0.0,
      "delivery_cues_applied": {
        "speed": "0.85",
        "pace": "children-120wpm",
        "language": "en-us"
      },
      "cost_usd": 0.0,
      "heading_only": true
    },
    {
      "section_id": "s02-objectives",
      "text": "Learning Objectives. By the end of this chapter, learners will be able to: Understand that the Earth is spherical. Identify the two types of movements of the Earth. Explain rotation and its effects. Understand revolution and its effects. Learn about different seasons caused by revolution. Define solstices and equinoxes and when they occur.",
      "body_text": "By the end of this chapter, learners will be able to: Understand that the Earth is spherical. Identify the two types of movements of the Earth. Explain rotation and its effects. Understand revolution and its effects. Learn about different seasons caused by revolution. Define solstices and equinoxes and when they occur.",
      "spoken_heading": "Learning Objectives.",
      "heading_duration_seconds": 1.14,
      "heading_holds": [],
      "body_start_seconds": 3.14,
      "topic_end_pause_seconds": 1.5,
      "audio_path": "D:\\InkSpectrum\\OpenMontage\\projects\\class-5-social-part-0-chapter-2-earth-movement\\assets\\audio\\narration-qwen-final-v1\\s02-objectives.wav",
      "duration_seconds": 21.306,
      "title_card_hold_seconds": 2.0,
      "voice_used": "approved-indian-reference-clone",
      "wer": 0.0,
      "delivery_cues_applied": {
        "speed": "0.85",
        "pace": "children-120wpm",
        "language": "en-us"
      },
      "cost_usd": 0.0
    },
    {
      "section_id": "s03-startup",
      "text": "Start-Up Activity. Take a ball and spin it. Notice how it moves. Imagine this is the Earth moving in space. The Earth moves in two ways—let's explore these movements and their effects!",
      "body_text": "Take a ball and spin it. Notice how it moves. Imagine this is the Earth moving in space. The Earth moves in two ways—let's explore these movements and their effects!",
      "spoken_heading": "Start-Up Activity.",
      "heading_duration_seconds": 1.0,
      "heading_holds": [],
      "body_start_seconds": 3.0,
      "topic_end_pause_seconds": 1.5,
      "audio_path": "D:\\InkSpectrum\\OpenMontage\\projects\\class-5-social-part-0-chapter-2-earth-movement\\assets\\audio\\narration-qwen-final-v1\\s03-startup.wav",
      "duration_seconds": 14.587,
      "title_card_hold_seconds": 2.0,
      "voice_used": "approved-indian-reference-clone",
      "wer": 0.0,
      "delivery_cues_applied": {
        "speed": "0.85",
        "pace": "children-120wpm",
        "language": "en-us"
      },
      "cost_usd": 0.0
    },
    {
      "section_id": "s04-spherical-earth",
      "text": "Who proved that the earth is spherical? Many ancient civilizations believed that the Earth was flat. However, Greek philosopher Pythagoras was one of the first to suggest that the Earth is spherical. Later, Aristotle provided evidence by observing how ships disappear over the horizon and how the Earth's shadow on the Moon is curved during a lunar eclipse. Ferdinand Magellan's voyage around the world further confirmed that the Earth is round.",
      "body_text": "Many ancient civilizations believed that the Earth was flat. However, Greek philosopher Pythagoras was one of the first to suggest that the Earth is spherical. Later, Aristotle provided evidence by observing how ships disappear over the horizon and how the Earth's shadow on the Moon is curved during a lunar eclipse. Ferdinand Magellan's voyage around the world further confirmed that the Earth is round.",
      "spoken_heading": "Who proved that the earth is spherical?",
      "heading_duration_seconds": 1.7,
      "heading_holds": [],
      "body_start_seconds": 3.7,
      "topic_end_pause_seconds": 1.5,
      "audio_path": "D:\\InkSpectrum\\OpenMontage\\projects\\class-5-social-part-0-chapter-2-earth-movement\\assets\\audio\\narration-qwen-final-v1\\s04-spherical-earth.wav",
      "duration_seconds": 27.339,
      "title_card_hold_seconds": 2.0,
      "voice_used": "approved-indian-reference-clone",
      "wer": 0.0,
      "delivery_cues_applied": {
        "speed": "0.85",
        "pace": "children-120wpm",
        "language": "en-us"
      },
      "cost_usd": 0.0
    },
    {
      "section_id": "s05-two-movements",
      "text": "The Two Movements of the Earth. The Earth moves in two ways: Rotation – The Earth spins on its axis around itself. Revolution – The Earth moves around the Sun.",
      "body_text": "The Earth moves in two ways: Rotation – The Earth spins on its axis around itself. Revolution – The Earth moves around the Sun.",
      "spoken_heading": "The Two Movements of the Earth.",
      "heading_duration_seconds": 1.56,
      "heading_holds": [],
      "body_start_seconds": 3.56,
      "topic_end_pause_seconds": 1.5,
      "audio_path": "D:\\InkSpectrum\\OpenMontage\\projects\\class-5-social-part-0-chapter-2-earth-movement\\assets\\audio\\narration-qwen-final-v1\\s05-two-movements.wav",
      "duration_seconds": 12.9,
      "title_card_hold_seconds": 2.0,
      "voice_used": "approved-indian-reference-clone",
      "wer": 0.0,
      "delivery_cues_applied": {
        "speed": "0.85",
        "pace": "children-120wpm",
        "language": "en-us"
      },
      "cost_usd": 0.0
    },
    {
      "section_id": "s06-rotation",
      "text": "Rotation. Rotation is the movement of the Earth around its own axis is called Rotation. The earth rotates from west to east. It completes one full rotation in 24 hours. The speed of rotation is faster at the equator and slower at the poles. The axis is tilted at an angle of 23.5°. As the Earth is spherical in shape, only one half of the Earth receives sunlight at a time. Thus, the side of the Earth facing the Sun experience day. On the other hand, the other half, or the part away from the sun, experiences night. As the Earth rotates, the lighted part moves into the darkness. Rotation causes day and night.",
      "body_text": "Rotation is the movement of the Earth around its own axis is called Rotation. The earth rotates from west to east. It completes one full rotation in 24 hours. The speed of rotation is faster at the equator and slower at the poles. The axis is tilted at an angle of 23.5°. As the Earth is spherical in shape, only one half of the Earth receives sunlight at a time. Thus, the side of the Earth facing the Sun experience day. On the other hand, the other half, or the part away from the sun, experiences night. As the Earth rotates, the lighted part moves into the darkness. Rotation causes day and night.",
      "spoken_heading": "Rotation.",
      "heading_duration_seconds": 0.98,
      "heading_holds": [],
      "body_start_seconds": 2.98,
      "topic_end_pause_seconds": 1.5,
      "audio_path": "D:\\InkSpectrum\\OpenMontage\\projects\\class-5-social-part-0-chapter-2-earth-movement\\assets\\audio\\narration-qwen-final-v1\\s06-rotation.wav",
      "duration_seconds": 42.12,
      "title_card_hold_seconds": 2.0,
      "voice_used": "approved-indian-reference-clone",
      "wer": 0.0,
      "delivery_cues_applied": {
        "speed": "0.85",
        "pace": "children-120wpm",
        "language": "en-us"
      },
      "cost_usd": 0.0
    },
    {
      "section_id": "s07-do-you-know",
      "text": "Do You Know? The Earth rotates at a speed of 1,670 kilometers per hour at the equator, but we don’t feel it because we’re moving along with it!",
      "body_text": "The Earth rotates at a speed of 1,670 kilometers per hour at the equator, but we don’t feel it because we’re moving along with it!",
      "spoken_heading": "Do You Know?",
      "heading_duration_seconds": 0.94,
      "heading_holds": [],
      "body_start_seconds": 2.94,
      "topic_end_pause_seconds": 1.5,
      "audio_path": "D:\\InkSpectrum\\OpenMontage\\projects\\class-5-social-part-0-chapter-2-earth-movement\\assets\\audio\\narration-qwen-final-v1\\s07-do-you-know.wav",
      "duration_seconds": 13.888,
      "title_card_hold_seconds": 2.0,
      "voice_used": "approved-indian-reference-clone",
      "wer": 0.0,
      "delivery_cues_applied": {
        "speed": "0.85",
        "pace": "children-120wpm",
        "language": "en-us"
      },
      "cost_usd": 0.0
    },
    {
      "section_id": "s08-revolution",